{
  "id": "saturn-square-pluto",
  "kind": "natal-aspect",
  "displayTitle": "Steady Or Intense",
  "summary": "Discipline and limits press against power and transformation. This frictional pattern asks you to use maturity and depth with awareness.",
  "body": "Discipline and limits press against power and transformation. This frictional pattern asks you to use maturity and depth with awareness. Strict accountability and early, immediate retribution; severity and rigidity. The friction makes the pattern noticeable, especially when pressure forces an adjustment. In practice, this can show up through discipline and limits, power and transformation, and the choices you make when fear or control starts running the room.",
  "gift": "The gift is maturity, depth, and a more conscious way to work with discipline and limits and power and transformation.",
  "shadow": "The shadow is fear, control, and repeating the same pattern without noticing what it is trying to teach.",
  "integration": "Let discipline and limits and power and transformation cooperate without making either one carry the whole story. Able to carry punishing, transformative work; the risk is harshness.",
  "do": [
    "Name how discipline and limits and power and transformation are both involved",
    "Pause before choosing the most familiar reaction",
    "Turn maturity and depth into one concrete choice"
  ],
  "dont": [
    "Let fear make the decision",
    "Treat tension as proof that something is wrong",
    "Ignore the needs of discipline and limits or power and transformation"
  ],
  "lifeAreas": [
    "work",
    "power",
    "growth"
  ],
  "tags": [
    "saturn",
    "pluto",
    "square",
    "maturity",
    "depth"
  ],
  "intensity": 5,
  "sourceFactors": [
    {
      "type": "natal-aspect",
      "planetA": "saturn",
      "aspect": "square",
      "planetB": "pluto"
    }
  ],
  "collectionHints": [
    "career-patterns",
    "shadow-work"
  ],
  "voiceNeutral": true,
  "status": "DRAFT"
}
